{"anchors":[{"at":"2026-07-27T15:01:00Z","link":"edc95cc965df1174b00847b99dbdeacf35ff09f7780d115c8676a6452d25134e","proof":"MIICzwYJKoZIhvcNAQcBoIICwDCCArwCAQMxDTALBglghkgBZQMEAgEwZgYLKoZIhvcNAQkQAQSgVwRVMFMCAQEGCSsGAQQBho0fATAvMAsGCWCGSAFlAwQCAQQgtRudZhxkVNjn6qws+BnSiNVAekvoGiTNF2JOcAlMUr4CASoYDzIwMjYwNzI3MTUwMTAwWqCCAU8wggFLMIH+oAMCAQICAQcwBQYDK2VwMDoxODA2BgNVBAMML0xvb21TZWFsIGNvbmZvcm1hbmNlIHZlY3RvciB0aW1lc3RhbXAgYXV0aG9yaXR5MB4XDTI2MDEwMTAwMDAwMFoXDTI3MDEwMTAwMDAwMFowOjE4MDYGA1UEAwwvTG9vbVNlYWwgY29uZm9ybWFuY2UgdmVjdG9yIHRpbWVzdGFtcCBhdXRob3JpdHkwKjAFBgMrZXADIQAx3r5V03xyJ2ixNxMcqmCHCAsuC2C5S9eF0UV1z6SYvKMpMCcwFgYDVR0lAQH/BAwwCgYIKwYBBQUHAwgwDQYDVR0OBAYEBExTAQIwBQYDK2VwA0EAKsmPQ6/DXSp5hCUxTqgjYkiyrpecOaOgOqiF4EtpwSMV22wJt+etLlExoNWNvfswgDRBGImjY/l+tqmrMRsLCTGB7DCB6QIBATA/MDoxODA2BgNVBAMML0xvb21TZWFsIGNvbmZvcm1hbmNlIHZlY3RvciB0aW1lc3RhbXAgYXV0aG9yaXR5AgEHMAsGCWCGSAFlAwQCAaBNMBoGCSqGSIb3DQEJAzENBgsqhkiG9w0BCRABBDAvBgkqhkiG9w0BCQQxIgQgXMj4iS0pu03u7HVhUgGqHSLlOLIOC6rrnK6/GS1S5l8wBQYDK2VwBEACUAGeA+dHYb4ngppO0bw/SKyqX53Vt3rUqMNRDH1Ed7PUDRiHlm2O7h6dHy7PEJYRVORPdlgF0qXl5jmleRwO","ref":"https://tsa.example/tsr","seq":1,"type":"rfc3161"}],"bundle_id":"lsb_vectors","chain":{"head":{"link":"edc95cc965df1174b00847b99dbdeacf35ff09f7780d115c8676a6452d25134e","seq":1},"keyed":false,"params":{"install_id":"in_vectors"},"profile":"loomseal-chain-v1"},"claims":[{"at":"2026-07-27T15:00:00Z","chain":{"link":"edc95cc965df1174b00847b99dbdeacf35ff09f7780d115c8676a6452d25134e","prev":"","seq":1},"payload":{"actor":"release-token","method":"POST","path":"/api/runs"},"type":"switchtender.audit/1"}],"created_at":"2026-07-27T15:00:00Z","loomseal":"0.1","producer":{"install_id":"in_vectors","key_id":"sha256:65b60673d6ed884bf01c2c222d82ada0740f29ac3355d6a925c81f17f47a27b8","product":"vectors","product_version":"0.1.0","public_key":"ebVWLo/mVPlAeLES6KmLp5AfhTrmlb7X4OORC60ElmQ="},"signatures":[{"alg":"ed25519","key_id":"sha256:65b60673d6ed884bf01c2c222d82ada0740f29ac3355d6a925c81f17f47a27b8","sig":"WPYE7B3DrKtA/7uK2iv1z1E9HnE3S/EAJSADus4LFjWC0MsMJv9JpeOU6j/tmOMGrizxGN++8sNKVdZU/dWwBA=="}],"subject":{"id":"demo-yard","type":"fleet"}}