{"anchors":[{"at":"2026-07-27T15:01:00Z","link":"edc95cc965df1174b00847b99dbdeacf35ff09f7780d115c8676a6452d25134e","proof":"MIICzwYJKoZIhvcNAQcCoIICwDCCArwCAQMxDTALBglghkgBZQMEAgEwZgYLKoZIhvcNAQkQAQSgVwRVMFMCAQEGCSsGAQQBho0fATAvMAsGCWCGSAFlAwQCAgQgtRudZhxkVNjn6qws+BnSiNVAekvoGiTNF2JOcAlMUr4CASoYDzIwMjYwNzI3MTUwMTAwWqCCAU8wggFLMIH+oAMCAQICAQcwBQYDK2VwMDoxODA2BgNVBAMML0xvb21TZWFsIGNvbmZvcm1hbmNlIHZlY3RvciB0aW1lc3RhbXAgYXV0aG9yaXR5MB4XDTI2MDEwMTAwMDAwMFoXDTI3MDEwMTAwMDAwMFowOjE4MDYGA1UEAwwvTG9vbVNlYWwgY29uZm9ybWFuY2UgdmVjdG9yIHRpbWVzdGFtcCBhdXRob3JpdHkwKjAFBgMrZXADIQAx3r5V03xyJ2ixNxMcqmCHCAsuC2C5S9eF0UV1z6SYvKMpMCcwFgYDVR0lAQH/BAwwCgYIKwYBBQUHAwgwDQYDVR0OBAYEBExTAQIwBQYDK2VwA0EAKsmPQ6/DXSp5hCUxTqgjYkiyrpecOaOgOqiF4EtpwSMV22wJt+etLlExoNWNvfswgDRBGImjY/l+tqmrMRsLCTGB7DCB6QIBATA/MDoxODA2BgNVBAMML0xvb21TZWFsIGNvbmZvcm1hbmNlIHZlY3RvciB0aW1lc3RhbXAgYXV0aG9yaXR5AgEHMAsGCWCGSAFlAwQCAaBNMBoGCSqGSIb3DQEJAzENBgsqhkiG9w0BCRABBDAvBgkqhkiG9w0BCQQxIgQg9cF81A0+7zxnXjX/zHxAl06KwTRniE7pl5GWc6XZcTwwBQYDK2VwBEBFlci6bDzf+gvBNvua9pnxDJidlYSyuiz7fwYPFdWjhJmWuVGBPO+EONK4OPQICSGetot7L5+06JcfqSR5MNQL","ref":"https://tsa.example/tsr","seq":1,"type":"rfc3161"}],"bundle_id":"lsb_vectors","chain":{"head":{"link":"edc95cc965df1174b00847b99dbdeacf35ff09f7780d115c8676a6452d25134e","seq":1},"keyed":false,"params":{"install_id":"in_vectors"},"profile":"loomseal-chain-v1"},"claims":[{"at":"2026-07-27T15:00:00Z","chain":{"link":"edc95cc965df1174b00847b99dbdeacf35ff09f7780d115c8676a6452d25134e","prev":"","seq":1},"payload":{"actor":"release-token","method":"POST","path":"/api/runs"},"type":"switchtender.audit/1"}],"created_at":"2026-07-27T15:00:00Z","loomseal":"0.1","producer":{"install_id":"in_vectors","key_id":"sha256:65b60673d6ed884bf01c2c222d82ada0740f29ac3355d6a925c81f17f47a27b8","product":"vectors","product_version":"0.1.0","public_key":"ebVWLo/mVPlAeLES6KmLp5AfhTrmlb7X4OORC60ElmQ="},"signatures":[{"alg":"ed25519","key_id":"sha256:65b60673d6ed884bf01c2c222d82ada0740f29ac3355d6a925c81f17f47a27b8","sig":"7URq3ptT6hyFPnnp0roEiPe6orVg2yXC4nfQwGdaMr48+rdSIhk+ctwF4CsC88b7w9oHFtZIZw9xfXiISdoXAw=="}],"subject":{"id":"demo-yard","type":"fleet"}}