{"bundle_id":"lsb_vectors","chain":{"head":{"link":"fc3fa557c0b233b849962dd26868f16a0b39f8ec99da7e7a3fe071e8e1678d6c","seq":1},"keyed":false,"params":{"install_id":"in_vectors"},"profile":"loomseal-chain-v1"},"claims":[{"at":"2026-07-27T15:00:00Z","chain":{"link":"fc3fa557c0b233b849962dd26868f16a0b39f8ec99da7e7a3fe071e8e1678d6c","prev":"","seq":1},"evidence":[{"digest":"sha256:cdcdcdcdcdcdcdcdcdcdcdcdcdcdcdcdcdcdcdcdcdcdcdcdcdcdcdcdcdcdcdcd","media_type":"text/html","role":"snapshot"}],"payload":{"actor":"release-token","method":"POST","path":"/api/runs"},"type":"switchtender.audit/1"}],"created_at":"2026-07-27T15:00:00Z","loomseal":"0.1","producer":{"install_id":"in_vectors","key_id":"sha256:65b60673d6ed884bf01c2c222d82ada0740f29ac3355d6a925c81f17f47a27b8","product":"vectors","product_version":"0.1.0","public_key":"ebVWLo/mVPlAeLES6KmLp5AfhTrmlb7X4OORC60ElmQ="},"signatures":[{"alg":"ed25519","key_id":"sha256:65b60673d6ed884bf01c2c222d82ada0740f29ac3355d6a925c81f17f47a27b8","sig":"XVSfrRhIwToRajoPk2zOrTDYGE8YXJRIJ7Rm3MY3gY1/IJZ8f9MG3LsrO0WG23K1qUyq6JZwzq6h/Y3JG4AGAQ=="}],"subject":{"id":"demo-yard","type":"fleet"}}