{"bundle_id":"lsb_vectors","chain":{"head":{"link":"edc95cc965df1174b00847b99dbdeacf35ff09f7780d115c8676a6452d25134e","seq":1},"keyed":false,"params":{"install_id":"in_vectors"},"profile":"loomseal-chain-v1"},"claims":[{"at":"2026-07-27T15:00:00Z","chain":{"link":"edc95cc965df1174b00847b99dbdeacf35ff09f7780d115c8676a6452d25134e","prev":"","seq":1},"payload":{"actor":"release-token","method":"POST","path":"/api/runs"},"type":"switchtender.audit/1"}],"created_at":"2026-07-27T15:00:00Z","loomseal":"0.1","producer":{"install_id":"in_vectors","key_id":"sha256:65b60673d6ed884bf01c2c222d82ada0740f29ac3355d6a925c81f17f47a27b8","product":"vectors","product_version":"0.1.0","public_key":"ebVWLo/mVPlAeLES6KmLp5AfhTrmlb7X4OORC60ElmQ="},"signatures":[{"alg":"ed25519","key_id":"sha256:65b60673d6ed884bf01c2c222d82ada0740f29ac3355d6a925c81f17f47a27b8","sig":"QeQfs/R6nj7D2/4vyHMzmsp4j4i8cXR1nzXVZVVjdsafMI5PWRHPa0m3SEhBrwRc7keMyRo9O/b2FIWKYuiuCA=="}],"subject":{"id":"known-run","type":"run"}}