{"anchors":[{"at":"2026-07-27T15:01:00Z","link":"edc95cc965df1174b00847b99dbdeacf35ff09f7780d115c8676a6452d25134e","proof":"MIIDUAYJKoZIhvcNAQcCoIIDQTCCAz0CAQMxDTALBglghkgBZQMEAgEwZgYLKoZIhvcNAQkQAQSgVwRVMFMCAQEGCSsGAQQBho0fATAvMAsGCWCGSAFlAwQCAQQgtRudZhxkVNjn6qws+BnSiNVAekvoGiTNF2JOcAlMUr4CASoYDzIwMjYwNzI3MTUwMTAwWqCCAdAwggHMMIIBfqADAgECAgEHMAUGAytlcDA6MTgwNgYDVQQDDC9Mb29tU2VhbCBjb25mb3JtYW5jZSB2ZWN0b3IgdGltZXN0YW1wIGF1dGhvcml0eTAeFw0yNjAxMDEwMDAwMDBaFw0yNzAxMDEwMDAwMDBaMIG5MQswCQYDVQQGEwJERTEmMBEGA1UECgwKQWNtZSwgSW5jLjARBgNVBAsMClRpbWUrU3RhbXAxHjAcBgkqhkiG9w0BCQEWD3RzYUBleGFtcGxlLm9yZzETMBEGA1UEBwwKIFfDvHJ6YnVyZzEVMBMGA1UECB4MAEIAYQB5AGUAcgBuMRcwFQYKCZImiZPyLGQBGRYHZXhhbXBsZTEdMBsGA1UEAwwUIzEgVFNBOyA8IngiPiBcIBvChSAwKjAFBgMrZXADIQAx3r5V03xyJ2ixNxMcqmCHCAsuC2C5S9eF0UV1z6SYvKMpMCcwFgYDVR0lAQH/BAwwCgYIKwYBBQUHAwgwDQYDVR0OBAYEBExTAQIwBQYDK2VwA0EAs/U+wjzGhEgWQUw/KnOejx9kaCJLPlrpOPq5EDWQjbQwwDeB3tM5YtFt9mE0AwhHBtgmV2b/PxrcJJqLpkZtDjGB7DCB6QIBATA/MDoxODA2BgNVBAMML0xvb21TZWFsIGNvbmZvcm1hbmNlIHZlY3RvciB0aW1lc3RhbXAgYXV0aG9yaXR5AgEHMAsGCWCGSAFlAwQCAaBNMBoGCSqGSIb3DQEJAzENBgsqhkiG9w0BCRABBDAvBgkqhkiG9w0BCQQxIgQgXMj4iS0pu03u7HVhUgGqHSLlOLIOC6rrnK6/GS1S5l8wBQYDK2VwBEACUAGeA+dHYb4ngppO0bw/SKyqX53Vt3rUqMNRDH1Ed7PUDRiHlm2O7h6dHy7PEJYRVORPdlgF0qXl5jmleRwO","ref":"https://tsa.example/tsr","seq":1,"type":"rfc3161"}],"bundle_id":"lsb_vectors","chain":{"head":{"link":"edc95cc965df1174b00847b99dbdeacf35ff09f7780d115c8676a6452d25134e","seq":1},"keyed":false,"params":{"install_id":"in_vectors"},"profile":"loomseal-chain-v1"},"claims":[{"at":"2026-07-27T15:00:00Z","chain":{"link":"edc95cc965df1174b00847b99dbdeacf35ff09f7780d115c8676a6452d25134e","prev":"","seq":1},"payload":{"actor":"release-token","method":"POST","path":"/api/runs"},"type":"switchtender.audit/1"}],"created_at":"2026-07-27T15:00:00Z","loomseal":"0.1","producer":{"install_id":"in_vectors","key_id":"sha256:65b60673d6ed884bf01c2c222d82ada0740f29ac3355d6a925c81f17f47a27b8","product":"vectors","product_version":"0.1.0","public_key":"ebVWLo/mVPlAeLES6KmLp5AfhTrmlb7X4OORC60ElmQ="},"signatures":[{"alg":"ed25519","key_id":"sha256:65b60673d6ed884bf01c2c222d82ada0740f29ac3355d6a925c81f17f47a27b8","sig":"oB8NbNZEk2+b2Xy5/p7dz1UdY2I8nPfJJvOd9hYN3mhs49z5BHscchXTag40fHL+FbfTQ6eJ7FnubxEg0o2ZBA=="}],"subject":{"id":"demo-yard","type":"fleet"}}