{"anchors":[{"at":"2026-07-27T15:01:00Z","link":"edc95cc965df1174b00847b99dbdeacf35ff09f7780d115c8676a6452d25134e","proof":"MIIOiwYJKoZIhvcNAQcCoIIOfDCCDngCAQMxDTALBglghkgBZQMEAgEwZgYLKoZIhvcNAQkQAQSgVwRVMFMCAQEGCSsGAQQBho0fATAvMAsGCWCGSAFlAwQCAQQgtRudZhxkVNjn6qws+BnSiNVAekvoGiTNF2JOcAlMUr4CASoYDzIwMjYwNzI3MTUwMTAwWqCCAU8wggFLMIH+oAMCAQICAQcwBQYDK2VwMDoxODA2BgNVBAMML0xvb21TZWFsIGNvbmZvcm1hbmNlIHZlY3RvciB0aW1lc3RhbXAgYXV0aG9yaXR5MB4XDTI2MDEwMTAwMDAwMFoXDTI3MDEwMTAwMDAwMFowOjE4MDYGA1UEAwwvTG9vbVNlYWwgY29uZm9ybWFuY2UgdmVjdG9yIHRpbWVzdGFtcCBhdXRob3JpdHkwKjAFBgMrZXADIQAx3r5V03xyJ2ixNxMcqmCHCAsuC2C5S9eF0UV1z6SYvKMpMCcwFgYDVR0lAQH/BAwwCgYIKwYBBQUHAwgwDQYDVR0OBAYEBExTAQIwBQYDK2VwA0EAKsmPQ6/DXSp5hCUxTqgjYkiyrpecOaOgOqiF4EtpwSMV22wJt+etLlExoNWNvfswgDRBGImjY/l+tqmrMRsLCTGCDKcwggyjAgEBMD8wOjE4MDYGA1UEAwwvTG9vbVNlYWwgY29uZm9ybWFuY2UgdmVjdG9yIHRpbWVzdGFtcCBhdXRob3JpdHkCAQcwCwYJYIZIAWUDBAIBoE0wGgYJKoZIhvcNAQkDMQ0GCyqGSIb3DQEJEAEEMC8GCSqGSIb3DQEJBDEiBCBcyPiJLSm7Te7sdWFSAaodIuU4sg4Lquucrr8ZLVLmXzCCC70Gggu5Kv//////////////////////////////////////////////////////////////////////////////////////////////////////////////////////////////////////////////////////////////////////////////////////////////////////////////////////////////////////////////////////////////////////////////////////////////////////////////////////////////////////////////////////////////////////////////////////////////////////////////////////////////////////////////////////////////////////////////////////////////////////////////////////////////////////////////////////////////////////////////////////////////////////////////////////////////////////////////////////////////////////////////////////////////////////////////////////////////////////////////////////////////////////////////////////////////////////////////////////////////////////////////////////////////////////////////////////////////////////////////////////////////////////////////////////////////////////////////////////////////////////////////////////////////////////////////////////////////////////////////////////////////////////////////////////////////////////////////////////////////////////////////////////////////////////////////////////////////////////////////////////////////////////////////////////////////////////////////////////////////////////////////////////////////////////////////////////////////////////////////////////////////////////////////////////////////////////////////////////////////////////////////////////////////////////////////////////////////////////////////////////////////////////////////////////////////////////////////////////////////////////////////////////////////////////////////////////////////////////////////////////////////////////////////////////////////////////////////////////////////////////////////////////////////////////////////////////////////////////////////////////////////////////////////////////////////////////////////////////////////////////////////////////////////////////////////////////////////////////////////////////////////////////////////////////////////////////////////////////////////////////////////////////////////////////////////////////////////////////////////////////////////////////////////////////////////////////////////////////////////////////////////////////////////////////////////////////////////////////////////////////////////////////////////////////////////////////////////////////////////////////////////////////////////////////////////////////////////////////////////////////////////////////////////////////////////////////////////////////////////////////////////////////////////////////////////////////////////////////////////////////////////////////////////////////////////////////////////////////////////////////////////////////////////////////////////////////////////////////////////////////////////////////////////////////////////////////////////////////////////////////////////////////////////////////////////////////////////////////////////////////////////////////////////////////////////////////////////////////////////////////////////////////////////////////////////////////////////////////////////////////////////////////////////////////////////////////////////////////////////////////////////////////////////////////////////////////////////////////////////////////////////////////////////////////////////////////////////////////////////////////////////////////////////////////////////////////////////////////////////////////////////////////////////////////////////////////////////////////////////////////////////////////////////////////////////////////////////////////////////////////////////////////////////////////////////////////////////////////////////////////////////////////////////////////////////////////////////////////////////////////////////////////////////////////////////////////////////////////////////////////////////////////////////////////////////////////////////////////////////////////////////////////////////////////////////////////////////////////////////fwRAAlABngPnR2G+J4KaTtG8P0isql+d1bd61KjDUQx9RHez1A0Yh5Ztju4enR8uzxCWEVTkT3ZYBdKl5eY5pXkcDg==","ref":"https://tsa.example/tsr","seq":1,"type":"rfc3161"}],"bundle_id":"lsb_vectors","chain":{"head":{"link":"edc95cc965df1174b00847b99dbdeacf35ff09f7780d115c8676a6452d25134e","seq":1},"keyed":false,"params":{"install_id":"in_vectors"},"profile":"loomseal-chain-v1"},"claims":[{"at":"2026-07-27T15:00:00Z","chain":{"link":"edc95cc965df1174b00847b99dbdeacf35ff09f7780d115c8676a6452d25134e","prev":"","seq":1},"payload":{"actor":"release-token","method":"POST","path":"/api/runs"},"type":"switchtender.audit/1"}],"created_at":"2026-07-27T15:00:00Z","loomseal":"0.1","producer":{"install_id":"in_vectors","key_id":"sha256:65b60673d6ed884bf01c2c222d82ada0740f29ac3355d6a925c81f17f47a27b8","product":"vectors","product_version":"0.1.0","public_key":"ebVWLo/mVPlAeLES6KmLp5AfhTrmlb7X4OORC60ElmQ="},"signatures":[{"alg":"ed25519","key_id":"sha256:65b60673d6ed884bf01c2c222d82ada0740f29ac3355d6a925c81f17f47a27b8","sig":"7etvfdpU5AhOF1VMMByPELIbBxLyIbnZWSxY5en+fqvTRgORFw3BTIz8KV/eBkj50coLBUcFW7ju/1z3HwEpDw=="}],"subject":{"id":"demo-yard","type":"fleet"}}