{"bundle_id":"lsb_vectors","chain":{"head":{"link":"585d6c3375706671d70734578b1539294dcb1091dad69fb74a344f6dcd8d2ed1","seq":4},"keyed":false,"profile":"switchtender-audit-v1"},"claims":[{"at":"2026-07-27T15:00:00Z","chain":{"link":"a31abd3eeb7517b5f7f897f413c5bed497c2214f204f9b5330890cdb20d203b2","prev":"","seq":1},"payload":{"actor":"deploy-bot","actor_type":"agent","method":"POST","on_behalf_of":"dev-lead","path":"/v1/runs"},"type":"switchtender.audit/1"},{"at":"2026-07-27T15:00:00Z","chain":{"link":"7fbf0b940293910619d3ec4de980329fbc449a0a7104c80fb02e5e3aafdf5d72","prev":"a31abd3eeb7517b5f7f897f413c5bed497c2214f204f9b5330890cdb20d203b2","seq":2},"payload":{"actor":"ops-admin","actor_type":"session","content_digest":"sha256s:a40316369f083fc2bc7ce9b749c8c6c4a0bb9f7cab21de3f475fb927bf03e868:d69a8ee53c4002d57fd752d822ed88ab9371602b80a197ff7e09f66f77889acd","decision_body":{"decision_id":"aud_decision","reason_commitment":"sha256:98f7470918dfb7a578106556816113d32b32726ff5fe62cc25b9e36e82d70493","run_id":"run_vectors","separation_of_duties":{"decider":"ops-admin","independent":true,"requester":"dev-lead","required":true,"result":"satisfied"},"spec_digest":"sha256:7d2f78f0323bdf0a4f5a7d0ae7703533aa53320a17de42e2c5cc7a8cb126d7ee","verdict":"approved"},"decision_nonce":"3678665005e30aca386ccf93dfb8273186358a7dda73386a408a9d5eab7eec36","method":"DECISION","on_behalf_of":"ops-admin","path":"/runs/run_vectors/decision/approved","reason_random":"82190835687ddf4cf54abc7cbb52b7fe468a8b9a7f989d1fed6cd2397698c976","reason_text":"approved after the change review & the on-call <sign-off>"},"type":"switchtender.audit/1"},{"at":"2026-07-27T15:00:00Z","chain":{"link":"61a221b3697a3edb1a5f86acebe1b40158d44324f85c9794391a7aa6fff89634","prev":"7fbf0b940293910619d3ec4de980329fbc449a0a7104c80fb02e5e3aafdf5d72","seq":3},"payload":{"actor":"system:dispatcher","actor_type":"system","content_digest":"sha256s:bf6975c2f50ae5f8e344eb416ae53f770e88d62af068a4e39b1978a683faab08:777db3cb0878c2eacde67755747ad8daf3be69f375a5ee5a9ee365300e0536d7","method":"RELEASE","on_behalf_of":"deploy-bot","path":"/runs/run_vectors/steps/run_step/release","release_body":{"attempt":0,"index":1,"inputs_digest":"sha256:44136fa355b3678a1146ad16f7e8649e94fb4fc21fe77e8310c060f61caaff8a","roots":[{"content_digest":"sha256s:a40316369f083fc2bc7ce9b749c8c6c4a0bb9f7cab21de3f475fb927bf03e868:d69a8ee53c4002d57fd752d822ed88ab9371602b80a197ff7e09f66f77889acd","id":"aud_decision"}],"run_id":"run_vectors","spec_digest":"sha256:0ee58ff7ffbb9e53edeafdb74054cf4492b1d45591aa0c6e53b5b38162bf6ab7","step":"schema","step_run_id":"run_step"},"release_nonce":"451dfdef0ebc0dccdc7416ca126a18e5c5aab8acb15e759b5ab6f529b2b5321d","releaſe_body":{"attempt":0,"index":1,"inputs_digest":"sha256:44136fa355b3678a1146ad16f7e8649e94fb4fc21fe77e8310c060f61caaff8b","roots":[{"content_digest":"sha256s:a40316369f083fc2bc7ce9b749c8c6c4a0bb9f7cab21de3f475fb927bf03e868:d69a8ee53c4002d57fd752d822ed88ab9371602b80a197ff7e09f66f77889acd","id":"aud_decision"}],"run_id":"run_vectors","spec_digest":"sha256:0ee58ff7ffbb9e53edeafdb74054cf4492b1d45591aa0c6e53b5b38162bf6ab7","step":"schema","step_run_id":"run_step"}},"type":"switchtender.audit/1"},{"at":"2026-07-27T15:00:00Z","chain":{"link":"585d6c3375706671d70734578b1539294dcb1091dad69fb74a344f6dcd8d2ed1","prev":"61a221b3697a3edb1a5f86acebe1b40158d44324f85c9794391a7aa6fff89634","seq":4},"payload":{"actor":"system:dispatcher","actor_type":"system","content_digest":"sha256e:f76e0418fa42408f410503aa18d36524ad6187d1262e838f95cd306c15d5f4b1:261c76b350d0f88c384231d1a9334e3b48bde105280f353600641d4b9d91d637","method":"RUN","on_behalf_of":"deploy-bot","outcome_body":"{\"exit_code\":0,\"run_id\":\"run_vectors\",\"spec_digest\":\"sha256:7d2f78f0323bdf0a4f5a7d0ae7703533aa53320a17de42e2c5cc7a8cb126d7ee\",\"status\":\"succeeded\"}","outcome_nonce":"0d653e08577365aa90079257bfa5ef4a0c7618e0ecd91d09415113acbc891b2e","path":"/runs/run_vectors/outcome/succeeded","spec_body":"{\"command\":\"deploy\",\"tool\":\"bash\"}"},"type":"switchtender.audit/1"}],"created_at":"2026-07-27T15:00:00Z","loomseal":"0.1","producer":{"install_id":"in_vectors","key_id":"sha256:65b60673d6ed884bf01c2c222d82ada0740f29ac3355d6a925c81f17f47a27b8","product":"vectors","product_version":"0.1.0","public_key":"ebVWLo/mVPlAeLES6KmLp5AfhTrmlb7X4OORC60ElmQ="},"signatures":[{"alg":"ed25519","key_id":"sha256:65b60673d6ed884bf01c2c222d82ada0740f29ac3355d6a925c81f17f47a27b8","sig":"1NG95cMArMJ1zdH6okIwxHbyxP1v0QUe6OqIci1QrFvfp7JInUILsbpqUm9I48CGt41s7rcqeBdjDRju1ct4BQ=="}],"subject":{"id":"run_vectors","type":"run"}}