{"bundle_id":"lsb_vectors","chain":{"head":{"link":"081ac7124660b4a7057c51638ed527b725118994fc465714fca3af2c5b83afbf","seq":4},"keyed":false,"profile":"switchtender-audit-v1"},"claims":[{"at":"2026-07-27T15:00:00Z","chain":{"link":"4e03f42f52842aa7f4f086d13a210a6856f6a0abadea183e257d3c7554e2211c","prev":"","seq":1},"payload":{"actor":"release-token","method":"POST","path":"/api/runs"},"type":"switchtender.audit/1"},{"at":"2026-07-27T15:00:10Z","chain":{"link":"5865c7e6399c8998f2f35588f832f06cf154d75200d7086accba13ec0f4a2f38","prev":"4e03f42f52842aa7f4f086d13a210a6856f6a0abadea183e257d3c7554e2211c","seq":2},"payload":{"actor":"span","beat":1,"cadence_s":60,"count":1,"method":"SPAN","path":"/span/1?count=1&cadence_s=60","stream":"chain","ſtream":"chaio"},"type":"loomseal.span/1"},{"at":"2026-07-27T15:00:20Z","chain":{"link":"2708930b7fcf7cc87d7d12201cd2c1b494b2f39847766cb2b744cf8de6d2dcbb","prev":"5865c7e6399c8998f2f35588f832f06cf154d75200d7086accba13ec0f4a2f38","seq":3},"payload":{"actor":"release-token","method":"POST","path":"/api/runs"},"type":"switchtender.audit/1"},{"at":"2026-07-27T15:00:30Z","chain":{"link":"081ac7124660b4a7057c51638ed527b725118994fc465714fca3af2c5b83afbf","prev":"2708930b7fcf7cc87d7d12201cd2c1b494b2f39847766cb2b744cf8de6d2dcbb","seq":4},"payload":{"actor":"span","beat":2,"cadence_s":60,"count":1,"method":"SPAN","path":"/span/2?count=1&cadence_s=60","stream":"chain"},"type":"loomseal.span/1"}],"created_at":"2026-07-27T15:00:00Z","loomseal":"0.1","producer":{"install_id":"in_vectors","key_id":"sha256:65b60673d6ed884bf01c2c222d82ada0740f29ac3355d6a925c81f17f47a27b8","product":"vectors","product_version":"0.1.0","public_key":"ebVWLo/mVPlAeLES6KmLp5AfhTrmlb7X4OORC60ElmQ="},"signatures":[{"alg":"ed25519","key_id":"sha256:65b60673d6ed884bf01c2c222d82ada0740f29ac3355d6a925c81f17f47a27b8","sig":"2F4PwkKBjS0JDGe/mjbW+1V9XrvQUjvyVt5acCoTcQnejy++3I1YRrJ+q9K6Cj3+GkwcIIdjXUzQc/P+h+HQCg=="}],"subject":{"id":"run_vectors","type":"run"}}