{"anchors":[{"at":"2026-07-27T15:01:00Z","link":"edc95cc965df1174b00847b99dbdeacf35ff09f7780d115c8676a6452d25134e","proof":"MIIElgYJKoZIhvcNAQcCoIIEhzCCBIMCAQMxDTALBglghkgBZQMEAgEwZgYLKoZIhvcNAQkQAQSgVwRVMFMCAQEGCSsGAQQBho0fATAvMAsGCWCGSAFlAwQCAQQgtRudZhxkVNjn6qws+BnSiNVAekvoGiTNF2JOcAlMUr4CASoYDzIwMjYwNzI3MTUwMTAwWqCCAkwwggJIMIIB+qADAgECAgEHMAUGAytlcDA6MTgwNgYDVQQDDC9Mb29tU2VhbCBjb25mb3JtYW5jZSB2ZWN0b3IgdGltZXN0YW1wIGF1dGhvcml0eTAeFw0yNjAxMDEwMDAwMDBaFw0yNzAxMDEwMDAwMDBaMDoxODA2BgNVBAMML0xvb21TZWFsIGNvbmZvcm1hbmNlIHZlY3RvciB0aW1lc3RhbXAgYXV0aG9yaXR5MIIBJDANBgkqhkiG9w0BAQEFAAOCAREAMIIBDAKCAQEA8c9Avj9R1brpt8KF0v2b+vbMUKHkBt9hJ2nE1Fsv1Wfsx3Gv7c4zMdZSghiTwoB1gsuS3bKFkGQ+5rgDATmesqXYBarqw4gc75ovUx0ekSvtvuBam0wClvw9rluY0GrlBv5USOX5dWC3jnGgDn9652rOERORP9lxYe73B96hQvLC5WO4lk5ov29PQS13BPMLqcbmT1Fzd4nKTYcJ3ZIc8ZtRTmY1UpRDaZvpcHjvJCA+gdxdS6baLQ0QpknQpyN7CMAxWq06lB4tID/Eth94gdirMiVXs7iCHvZQTVwfB5d1dveqRKGtTCfFiG4EElTLW3J6zsywJOMVjU/d1N/3jQIFAP////ujKTAnMBYGA1UdJQEB/wQMMAoGCCsGAQUFBwMIMA0GA1UdDgQGBARMUwECMAUGAytlcANBAH8aNBcU3q9R8KkToPGOSfnVwxtN5N4Khdt9LmaoSUQe3LRoYShFlKxizyoaWTCZQfCM/XfKk+faMvK951z10g0xggG1MIIBsQIBATA/MDoxODA2BgNVBAMML0xvb21TZWFsIGNvbmZvcm1hbmNlIHZlY3RvciB0aW1lc3RhbXAgYXV0aG9yaXR5AgEHMAsGCWCGSAFlAwQCAaBNMBoGCSqGSIb3DQEJAzENBgsqhkiG9w0BCRABBDAvBgkqhkiG9w0BCQQxIgQgXMj4iS0pu03u7HVhUgGqHSLlOLIOC6rrnK6/GS1S5l8wCwYJKoZIhvcNAQELBIIBACtUbz4t7RHhW8Q1PSFTy27ZB6rzUYUUVAYTe4epb4xZBm6OeLhS95CnDuiTD0KAPoCTpqIffxGGssGP57s0QH609wGmhD3CpIzEV+XP9KEKzDVnsvdwnUwG3iSuRQgHeWD4BI7J5wGoKTMc2SO232jYOyTb5kQrKkMXLxXEW2GbLfn1HwmDJMY+aSJlKk2FyiGcV9kKTbny5koJhvoGMufgOKeFrlrZLTe0j/cG5hXGfdKGUJnzVlRJe1rsyYLkmJns9PQTYLxwpmhSRFJ5t8Nwcy5M4FuD/Ab9B2qT1eRe3B0rMyzcnDk7qW9IhHi3RXFOMwuweXPwdJTxT7ABNow=","ref":"https://tsa.example/tsr","seq":1,"type":"rfc3161"}],"bundle_id":"lsb_vectors","chain":{"head":{"link":"edc95cc965df1174b00847b99dbdeacf35ff09f7780d115c8676a6452d25134e","seq":1},"keyed":false,"params":{"install_id":"in_vectors"},"profile":"loomseal-chain-v1"},"claims":[{"at":"2026-07-27T15:00:00Z","chain":{"link":"edc95cc965df1174b00847b99dbdeacf35ff09f7780d115c8676a6452d25134e","prev":"","seq":1},"payload":{"actor":"release-token","method":"POST","path":"/api/runs"},"type":"switchtender.audit/1"}],"created_at":"2026-07-27T15:00:00Z","loomseal":"0.1","producer":{"install_id":"in_vectors","key_id":"sha256:65b60673d6ed884bf01c2c222d82ada0740f29ac3355d6a925c81f17f47a27b8","product":"vectors","product_version":"0.1.0","public_key":"ebVWLo/mVPlAeLES6KmLp5AfhTrmlb7X4OORC60ElmQ="},"signatures":[{"alg":"ed25519","key_id":"sha256:65b60673d6ed884bf01c2c222d82ada0740f29ac3355d6a925c81f17f47a27b8","sig":"w5123GNpFWkmHtLJMNfUsBANr8f6OSF9WLfqulRnDFRQ+rmY3+CzYJyQUBAeONNOxTkQwY0WOu99S9zsfU/oBg=="}],"subject":{"id":"demo-yard","type":"fleet"}}