{"bundle_id":"lsb_vectors","chain":{"head":{"link":"b884e022cab3ee03b15ae6bb3cfde0a90ac87a43d1ac57c05cfae9878453176f","seq":1},"keyed":false,"params":{"install_id":"in_vectors"},"profile":"loomseal-chain-v1"},"claims":[{"at":"0001-01-01T00:00:00Z","chain":{"link":"b884e022cab3ee03b15ae6bb3cfde0a90ac87a43d1ac57c05cfae9878453176f","prev":"","seq":1},"payload":{"actor":"release-token","method":"POST","path":"/api/runs"},"type":"switchtender.audit/1"}],"created_at":"2026-07-27T15:00:00Z","loomseal":"0.1","producer":{"install_id":"in_vectors","key_id":"sha256:65b60673d6ed884bf01c2c222d82ada0740f29ac3355d6a925c81f17f47a27b8","product":"vectors","product_version":"0.1.0","public_key":"ebVWLo/mVPlAeLES6KmLp5AfhTrmlb7X4OORC60ElmQ="},"signatures":[{"alg":"ed25519","key_id":"sha256:65b60673d6ed884bf01c2c222d82ada0740f29ac3355d6a925c81f17f47a27b8","sig":"Rbv9ajLEnXbmeqVVz6h75GyFoUYRQ+x3f/OjduwmWA2/8vWbH49TH8pt5p78xXKxHsMOmiHDI5MIfq2v6dGxCg=="}],"subject":{"id":"demo-yard","type":"fleet"}}