{"bundle_id":"lsb_vectors","chain":{"head":{"link":"d778a7307f0e3f37689e7069151083febf3b0e71782e8f453c7172f66c046017","seq":1},"keyed":false,"params":{"install_id":"in_vectors"},"profile":"loomseal-chain-v1"},"claims":[{"at":"2026-07-27T24:00:00Z","chain":{"link":"d778a7307f0e3f37689e7069151083febf3b0e71782e8f453c7172f66c046017","prev":"","seq":1},"payload":{"actor":"release-token","method":"POST","path":"/api/runs"},"type":"switchtender.audit/1"}],"created_at":"2026-07-27T15:00:00Z","loomseal":"0.1","producer":{"install_id":"in_vectors","key_id":"sha256:65b60673d6ed884bf01c2c222d82ada0740f29ac3355d6a925c81f17f47a27b8","product":"vectors","product_version":"0.1.0","public_key":"ebVWLo/mVPlAeLES6KmLp5AfhTrmlb7X4OORC60ElmQ="},"signatures":[{"alg":"ed25519","key_id":"sha256:65b60673d6ed884bf01c2c222d82ada0740f29ac3355d6a925c81f17f47a27b8","sig":"pcA3oiVAD5L7yk/I/K0tg/HNudYGCzIgcW7MfUJ1n01X7eiFilGsN7b0WO9g6ALiVAExOXHhSAhYeelIVU9iAg=="}],"subject":{"id":"demo-yard","type":"fleet"}}