{"anchors":[{"at":"2026-07-01T00:00:00Z","link":"e7fe6e16ed4c897e998096aafdb397e395f3cd6dfecbb94948b6f3c7166a786b","ref":"https://github.com/example/anchors/commit/abc123","seq":2,"type":"git"}],"bundle_id":"lsb_vectors","chain":{"head":{"link":"e7fe6e16ed4c897e998096aafdb397e395f3cd6dfecbb94948b6f3c7166a786b","seq":2},"keyed":false,"params":{"install_id":"in_vectors"},"profile":"loomseal-chain-v1"},"claims":[{"at":"2026-07-27T15:00:00Z","chain":{"link":"edc95cc965df1174b00847b99dbdeacf35ff09f7780d115c8676a6452d25134e","prev":"","seq":1},"payload":{"actor":"release-token","method":"POST","path":"/api/runs"},"type":"switchtender.audit/1"},{"at":"2026-07-27T15:00:00Z","chain":{"link":"e7fe6e16ed4c897e998096aafdb397e395f3cd6dfecbb94948b6f3c7166a786b","prev":"edc95cc965df1174b00847b99dbdeacf35ff09f7780d115c8676a6452d25134e","seq":2},"payload":{"actor":"release-token","method":"POST","path":"/api/runs"},"type":"switchtender.audit/1"}],"created_at":"2026-07-27T15:00:00Z","loomseal":"0.1","producer":{"install_id":"in_vectors","key_id":"sha256:65b60673d6ed884bf01c2c222d82ada0740f29ac3355d6a925c81f17f47a27b8","product":"vectors","product_version":"0.1.0","public_key":"ebVWLo/mVPlAeLES6KmLp5AfhTrmlb7X4OORC60ElmQ="},"signatures":[{"alg":"ed25519","key_id":"sha256:65b60673d6ed884bf01c2c222d82ada0740f29ac3355d6a925c81f17f47a27b8","sig":"pRWCWyXE+QbKBv3HCLaIGcfXRZ/Tgd0IqzCi9+81mL6yRjWmqgRQdBlSWddK7M+eeiMNifTiT8O1FK5MlvxmAA=="}],"subject":{"id":"demo-yard","type":"fleet"}}