{"bundle_id":"lsb_vectors","chain":{"consistency":{"from_root":"8d9b9921c6a45a7e12c05fa0fadb9134adceaf453a261b53ce9b3b42845941d6","from_size":4,"path":["e900f2c27489c0fd969ce4d7906c15f9ec4a8756a90dada0eab1288cce2a3e0a"]},"head":{"link":"cbbc4125100804fe963a6beeafd5a568fa52598e764720d8f19add05c67cb909","seq":6},"keyed":false,"params":{"install_id":"in_vectors"},"profile":"loomseal-merkle-v1"},"claims":[{"at":"2026-07-27T15:00:00Z","chain":{"link":"ebe35075f5dafaf42c207550f1544ea003157dd26cca9df2ab057775c3fd8c9c","prev":"","seq":1},"inclusion":{"path":["c1c953c4247fc0a562bc0120ae43effb26fc1caefb5c845edb0dc7f77d8e3faa","3e45a0d2fe1a6fe8ae5414ee23dec7d7fd0c1e390d343ef7a0f105f1d467703b","e900f2c27489c0fd969ce4d7906c15f9ec4a8756a90dada0eab1288cce2a3e0a"]},"payload":{"actor":"release-token","method":"POST","path":"/api/runs/0"},"type":"switchtender.audit/1"},{"at":"2026-07-27T15:00:00Z","chain":{"link":"5bbba337a1dda9e765a0c8c1bc24855cc11e368502d701f02bc2cee6ff3e9b5a","prev":"","seq":6},"inclusion":{"path":["830fbe0885891ebec1644ade3b0ed4a824c499ff9d45dccabb9a04aff817b4bd","ffa09e63c9e22e13647b6fd7520dde8400aacd8f4d37fec446d593ce241648ee"]},"payload":{"actor":"release-token","method":"POST","path":"/api/runs/5"},"type":"switchtender.audit/1"}],"created_at":"2026-07-27T15:00:00Z","loomseal":"0.1","producer":{"install_id":"in_vectors","key_id":"sha256:65b60673d6ed884bf01c2c222d82ada0740f29ac3355d6a925c81f17f47a27b8","product":"vectors","product_version":"0.1.0","public_key":"ebVWLo/mVPlAeLES6KmLp5AfhTrmlb7X4OORC60ElmQ="},"signatures":[{"alg":"ed25519","key_id":"sha256:65b60673d6ed884bf01c2c222d82ada0740f29ac3355d6a925c81f17f47a27b8","sig":"Z6x4eseSFP7Kt4amI2xH7wWBirvpQgUKYYOlJ6p7ku+XRRiIC3UDVkIDjF8OBk3S8bw9EhhviMNJ4FxSoUZ6Ag=="}],"subject":{"id":"demo-yard","type":"fleet"}}