{"bundle_id":"lsb_vectors","chain":{"head":{"link":"0fe0f9677320a56161460f064514448d5fea7cb192c0197dfa0393e5389c89a5","seq":5},"keyed":false,"params":{"install_id":"in_vectors"},"profile":"loomseal-merkle-v1"},"claims":[{"at":"2026-07-27T15:00:00Z","chain":{"link":"4e5b780895036bffe24a2a8d7106676639a3be12ee093a7abe169374c00893f0","prev":"","seq":1},"inclusion":{"path":["bb4da05424ec9b243443c612e22fc4597b376dd79efab34c35f7d7bd8e717225","f3846d8a89512e706b2aaf424a58daafb1ad0cc1d396d4354bc189a7027721c8","380ea8a4af81a1b494df4cd7d173c481cb26923e4c4b7882e23710766c125469"]},"payload":{"crossing":"ingress","leaf_count":4,"verdict":"not-equivalent"},"type":"coble.equivalence/1"},{"at":"2026-07-27T15:00:00Z","chain":{"link":"bb4da05424ec9b243443c612e22fc4597b376dd79efab34c35f7d7bd8e717225","prev":"","seq":2},"inclusion":{"path":["4e5b780895036bffe24a2a8d7106676639a3be12ee093a7abe169374c00893f0","f3846d8a89512e706b2aaf424a58daafb1ad0cc1d396d4354bc189a7027721c8","380ea8a4af81a1b494df4cd7d173c481cb26923e4c4b7882e23710766c125469"]},"payload":{"class":"route-http","object":"shop.example.com/1","status":"match"},"type":"coble.comparison/1"},{"at":"2026-07-27T15:00:00Z","chain":{"link":"9492856711ec9bb1cf2c070ed1b1458db6d8517e1319781240263bc584cd8d3a","prev":"","seq":3},"inclusion":{"path":["a9aa97b6c59d2bed8cbc7683fe0934ece7cdf4024edaf09de169cc38c3d04c17","f53f103d10a7b47ff4329fd4059daf835f062a1126e29a722e22f6e1b15f4514","380ea8a4af81a1b494df4cd7d173c481cb26923e4c4b7882e23710766c125469"]},"payload":{"class":"route-http","object":"shop.example.com/2","status":"mismatch"},"type":"coble.comparison/1"},{"at":"2026-07-27T15:00:00Z","chain":{"link":"a9aa97b6c59d2bed8cbc7683fe0934ece7cdf4024edaf09de169cc38c3d04c17","prev":"","seq":4},"inclusion":{"path":["9492856711ec9bb1cf2c070ed1b1458db6d8517e1319781240263bc584cd8d3a","f53f103d10a7b47ff4329fd4059daf835f062a1126e29a722e22f6e1b15f4514","380ea8a4af81a1b494df4cd7d173c481cb26923e4c4b7882e23710766c125469"]},"payload":{"class":"route-http","object":"shop.example.com/3","status":"match"},"type":"coble.comparison/1"},{"at":"2026-07-27T15:00:00Z","chain":{"link":"380ea8a4af81a1b494df4cd7d173c481cb26923e4c4b7882e23710766c125469","prev":"","seq":5},"inclusion":{"path":["6e5ce18b3d56cc483d70cea15b553703387b462ba60a34d535660e57b0d7afc2"]},"payload":{"class":"route-http","object":"shop.example.com/4","status":"target-only"},"type":"coble.comparison/1"}],"created_at":"2026-07-27T15:00:00Z","loomseal":"0.1","producer":{"install_id":"in_vectors","key_id":"sha256:65b60673d6ed884bf01c2c222d82ada0740f29ac3355d6a925c81f17f47a27b8","product":"vectors","product_version":"0.1.0","public_key":"ebVWLo/mVPlAeLES6KmLp5AfhTrmlb7X4OORC60ElmQ="},"signatures":[{"alg":"ed25519","key_id":"sha256:65b60673d6ed884bf01c2c222d82ada0740f29ac3355d6a925c81f17f47a27b8","sig":"O0jeMEbLDQGDYaaqF7kKwvNAisI/bw6jPVydWLKW4xhDixer9FjJegN62AG8XOK9C066mJTH7lzMoX0ruM0ADA=="}],"subject":{"id":"demo-yard","type":"fleet"}}