{"bundle_id":"lsb_vectors","chain":{"head":{"link":"4e03f42f52842aa7f4f086d13a210a6856f6a0abadea183e257d3c7554e2211c","seq":1},"keyed":false,"profile":"switchtender-audit-v1"},"claims":[{"at":"2026-07-27T15:00:00Z","chain":{"link":"4e03f42f52842aa7f4f086d13a210a6856f6a0abadea183e257d3c7554e2211c","prev":"","seq":1},"payload":{"actor":"release-token","critical":1,"finding":"single maintainer","method":"POST","path":"/api/runs","topics_scored":5},"type":"whodar.knowledge-risk/1"}],"created_at":"2026-07-27T15:00:00Z","loomseal":"0.1","producer":{"install_id":"in_vectors","key_id":"sha256:65b60673d6ed884bf01c2c222d82ada0740f29ac3355d6a925c81f17f47a27b8","product":"vectors","product_version":"0.1.0","public_key":"ebVWLo/mVPlAeLES6KmLp5AfhTrmlb7X4OORC60ElmQ="},"signatures":[{"alg":"ed25519","key_id":"sha256:65b60673d6ed884bf01c2c222d82ada0740f29ac3355d6a925c81f17f47a27b8","sig":"IZe/CnQemc0Pd3ufFeL9KjFEG/olT8/cxQiZRMaJFojZub9CtX7YkI20S+NciejetEZe/mWL8OrCc5Ss3l9qAg=="}],"subject":{"id":"run_vectors","type":"run"}}