{"anchors":[{"at":"2026-07-27T15:01:00Z","link":"edc95cc965df1174b00847b99dbdeacf35ff09f7780d115c8676a6452d25134e","proof":"MIIElQYJKoZIhvcNAQcCoIIEhjCCBIICAQMxDTALBglghkgBZQMEAgEwZgYLKoZIhvcNAQkQAQSgVwRVMFMCAQEGCSsGAQQBho0fATAvMAsGCWCGSAFlAwQCAQQgtRudZhxkVNjn6qws+BnSiNVAekvoGiTNF2JOcAlMUr4CATAYDzIwMjYwNzI3MTUwMTAwWqCCAkowggJGMIIB+KADAgECAgEHMAUGAytlcDA6MTgwNgYDVQQDDC9Mb29tU2VhbCBjb25mb3JtYW5jZSB2ZWN0b3IgdGltZXN0YW1wIGF1dGhvcml0eTAeFw0yNjAxMDEwMDAwMDBaFw0yNzAxMDEwMDAwMDBaMDoxODA2BgNVBAMML0xvb21TZWFsIGNvbmZvcm1hbmNlIHZlY3RvciB0aW1lc3RhbXAgYXV0aG9yaXR5MIIBIjANBgkqhkiG9w0BAQEFAAOCAQ8AMIIBCgKCAQEBHyX76pAWDYIhWkRVbv4dXZAI0PPlDOiYbH3asVo2+SQGRWOz2wS/nEQ1nHqfEB5L6AHR9lLyd9jNI55hryIxbKCDY7Gx1XCapdoGW0VtnEsaCOFDUOMQcpEPFjct69/kKrZ2r9H+NZw8HC9r7imPAHH1zCHCGak9q6E7BIwfqVjUePhCjF+ujLPnRBWIIIETl35UF0DSos0Wx1jPOSlU8Y3lLfH1Qyj+04INcYbGtOFKxwjNii0J0wdrfesDlKghVy5rV1Vpve57Gp8U0ws/LTReAmmqg50Cw+bDjSBuy5Yt8y//rTKPpCFUTmIa95zQm3rEVlAK7McbjpFeIF2UEQIDAQABoykwJzAWBgNVHSUBAf8EDDAKBggrBgEFBQcDCDANBgNVHQ4EBgQETFMBAjAFBgMrZXADQQDQxmy0/A3BkoL/+Ilhb9cFlOUFAq40eYYMnM/QMV1pLqXWxsvvIYWXkREnGwnvAFVzqDKNulJYE17b6iUKe0wGMYIBtjCCAbICAQEwPzA6MTgwNgYDVQQDDC9Mb29tU2VhbCBjb25mb3JtYW5jZSB2ZWN0b3IgdGltZXN0YW1wIGF1dGhvcml0eQIBBzALBglghkgBZQMEAgGgTTAaBgkqhkiG9w0BCQMxDQYLKoZIhvcNAQkQAQQwLwYJKoZIhvcNAQkEMSIEIFF8TtI3qInoCrJD++aCtqHF32H2ZtzhjCm9p7E+VrjZMAsGCSqGSIb3DQEBCgSCAQEBGKGT9aR0BIIXIvyUWk/+qFrRScMrxZG37yv4mrp2kCABrAmT7eW5KBXr8wESdXYIzT9Mi/Z5pq9dZyHxDzwgN3VUv9qgMBVKGXyxx658bCrK3x/tY6E7JnIkFcRNTMyVgA5uIUlsVUmrUo59WzJ3xuVCtjm/JkFwsKdXqZ5crSzSJDGy2Hy8lUIhCfXJrreP5qYZqEhiLBrmCy9y0mXGfyE8grZsheOJtuOD0yvVGTWtkBiezGzvPN5j726+nZh5G2C1Co/Z0GdLLNhwhd72TM0b85X9NptQ29Kr42YmKz+r2cVku49hIj78BUVaAnRBaJucHXMxCdM38cK6WymHXw==","ref":"https://tsa.example/tsr","seq":1,"type":"rfc3161"}],"bundle_id":"lsb_vectors","chain":{"head":{"link":"edc95cc965df1174b00847b99dbdeacf35ff09f7780d115c8676a6452d25134e","seq":1},"keyed":false,"params":{"install_id":"in_vectors"},"profile":"loomseal-chain-v1"},"claims":[{"at":"2026-07-27T15:00:00Z","chain":{"link":"edc95cc965df1174b00847b99dbdeacf35ff09f7780d115c8676a6452d25134e","prev":"","seq":1},"payload":{"actor":"release-token","method":"POST","path":"/api/runs"},"type":"switchtender.audit/1"}],"created_at":"2026-07-27T15:00:00Z","loomseal":"0.1","producer":{"install_id":"in_vectors","key_id":"sha256:65b60673d6ed884bf01c2c222d82ada0740f29ac3355d6a925c81f17f47a27b8","product":"vectors","product_version":"0.1.0","public_key":"ebVWLo/mVPlAeLES6KmLp5AfhTrmlb7X4OORC60ElmQ="},"signatures":[{"alg":"ed25519","key_id":"sha256:65b60673d6ed884bf01c2c222d82ada0740f29ac3355d6a925c81f17f47a27b8","sig":"BzrdP8d2U7n0omzPcMo9F5hCCQfEc3CJYoq+R2T4H8twAm5K9uosLVGrAMpqbB10yoy2dvSwLdIkpRQC2IQCCQ=="}],"subject":{"id":"demo-yard","type":"fleet"}}