{"anchors":[{"at":"2026-07-27T15:01:00Z","link":"edc95cc965df1174b00847b99dbdeacf35ff09f7780d115c8676a6452d25134e","proof":"MIIEkwYJKoZIhvcNAQcCoIIEhDCCBIACAQMxDTALBglghkgBZQMEAgEwZgYLKoZIhvcNAQkQAQSgVwRVMFMCAQEGCSsGAQQBho0fATAvMAsGCWCGSAFlAwQCAQQgtRudZhxkVNjn6qws+BnSiNVAekvoGiTNF2JOcAlMUr4CASoYDzIwMjYwNzI3MTUwMTAwWqCCAkowggJGMIIB+KADAgECAgEHMAUGAytlcDA6MTgwNgYDVQQDDC9Mb29tU2VhbCBjb25mb3JtYW5jZSB2ZWN0b3IgdGltZXN0YW1wIGF1dGhvcml0eTAeFw0yNjAxMDEwMDAwMDBaFw0yNzAxMDEwMDAwMDBaMDoxODA2BgNVBAMML0xvb21TZWFsIGNvbmZvcm1hbmNlIHZlY3RvciB0aW1lc3RhbXAgYXV0aG9yaXR5MIIBIjANBgkqhkiG9w0BAQEFAAOCAQ8AMIIBCgKCAQEAuXfQ7uKhLmcEm19d7XhoRsrznI/YpwRUm3iRojhxd11zKYdXP7VFTvW4zKyb97Zdf/3mxP/DArWD46JwHi5DuHRT1A+Dv9Fw9I3qHUPwTHzfctEN9Qaw6JmnNK/NzpuPKzf/wAkh+IHW2mZWbRBWk3A1MSYRiRgC/mAbKEGW0CA/l60gVMD5h8UsqoC7jhUfaoG+r98W/z2EjAPuSaTnk+eAwxvndHbK+Blh9qRaWwY9hDcLM93Vp4MPWDAcvtI2OpJF0/92VgiCm104vqSQBiDDiwZpsdrqTee7fUhWoxYxvaF6eHulAd8q1izna7lUMSQBmw/JLVNU53ZUyRxLEQIDAQABoykwJzAWBgNVHSUBAf8EDDAKBggrBgEFBQcDCDANBgNVHQ4EBgQETFMBAjAFBgMrZXADQQCiITLcY9m0w8n45C2z7FrSkABVVhnyVYRi24BV4QEPdCJTZfMOwEFmusAfWuXg9Wo4/UM7SPEl/pUFLs7r79EHMYIBtDCCAbACAQEwPzA6MTgwNgYDVQQDDC9Mb29tU2VhbCBjb25mb3JtYW5jZSB2ZWN0b3IgdGltZXN0YW1wIGF1dGhvcml0eQIBBzALBglghkgBZQMEAgGgTTAaBgkqhkiG9w0BCQMxDQYLKoZIhvcNAQkQAQQwLwYJKoZIhvcNAQkEMSIEIFzI+IktKbtN7ux1YVIBqh0i5TiyDguq65yuvxktUuZfMAoGCCqGSM49BAMCBIIBABsTixm/Q1J2VHZrAGemGv7u+lLQ/uRfEC8cy43xhMfC5vK6Fus1cFT0zHgW9UWKdmr5VhZf6eVf+JR3vfGs71babBIoftGzAsYBShYhuMwgpHH3t6lLS/2xqw8FINBIZKJQRCdBUxFnZBArffas5meZOwUTqvWG2EVNM+P3NjGjwQUIJrbUxf3l9jWS7D4ThX/uqDsF8wDRxI9YxbUpmOqNQT5jYW2xzLM6fWVMBj84hKfvUI6ROW2LQFe4NhJvNwXlVXxgF7jUg1Q9mwX6C9lQdBIr/tc1bOynzopQ5+ZWCTTihc63eI8qpjTbb3NGBf3Ip0ewWLE5qJ2zKeG8DwU=","ref":"https://tsa.example/tsr","seq":1,"type":"rfc3161"}],"bundle_id":"lsb_vectors","chain":{"head":{"link":"edc95cc965df1174b00847b99dbdeacf35ff09f7780d115c8676a6452d25134e","seq":1},"keyed":false,"params":{"install_id":"in_vectors"},"profile":"loomseal-chain-v1"},"claims":[{"at":"2026-07-27T15:00:00Z","chain":{"link":"edc95cc965df1174b00847b99dbdeacf35ff09f7780d115c8676a6452d25134e","prev":"","seq":1},"payload":{"actor":"release-token","method":"POST","path":"/api/runs"},"type":"switchtender.audit/1"}],"created_at":"2026-07-27T15:00:00Z","loomseal":"0.1","producer":{"install_id":"in_vectors","key_id":"sha256:65b60673d6ed884bf01c2c222d82ada0740f29ac3355d6a925c81f17f47a27b8","product":"vectors","product_version":"0.1.0","public_key":"ebVWLo/mVPlAeLES6KmLp5AfhTrmlb7X4OORC60ElmQ="},"signatures":[{"alg":"ed25519","key_id":"sha256:65b60673d6ed884bf01c2c222d82ada0740f29ac3355d6a925c81f17f47a27b8","sig":"fgc4NnZLTFqvpKoI58KUi0a92TWKakBrN2WE0HGzG73/XsmIU5mnB9ezxyDOwHn/ztyKdsb/HTJjD025Ge5dDw=="}],"subject":{"id":"demo-yard","type":"fleet"}}