{"anchors":[{"at":"2026-07-27T15:01:00Z","link":"edc95cc965df1174b00847b99dbdeacf35ff09f7780d115c8676a6452d25134e","proof":"MIICygYJKoZIhvcNAQcCoIICuzCCArcCAQMxDTALBglghkgBZQMEAgEwZgYLKoZIhvcNAQkQAQSgVwRVMFMCAQEGCSsGAQQBho0fATAvMAsGCWCGSAFlAwQCAQQgtRudZhxkVNjn6qws+BnSiNVAekvoGiTNF2JOcAlMUr4CASoYDzIwMjYwNzI3MTUwMTAwWqCCAUowggFGMIH5AgEHMAUGAytlcDA6MTgwNgYDVQQDDC9Mb29tU2VhbCBjb25mb3JtYW5jZSB2ZWN0b3IgdGltZXN0YW1wIGF1dGhvcml0eTAeFw0yNjAxMDEwMDAwMDBaFw0yNzAxMDEwMDAwMDBaMDoxODA2BgNVBAMML0xvb21TZWFsIGNvbmZvcm1hbmNlIHZlY3RvciB0aW1lc3RhbXAgYXV0aG9yaXR5MCowBQYDK2VwAyEAMd6+VdN8cidosTcTHKpghwgLLgtguUvXhdFFdc+kmLyjKTAnMBYGA1UdJQEB/wQMMAoGCCsGAQUFBwMIMA0GA1UdDgQGBARMUwECMAUGAytlcANBAArDnN8cvIb125k9ahgYh3SfFkcIqHn0hQFgAVIU1ddKpUdebFhQ404jTo5Z8eCLYHPDh+pzujFLigeZ7EDpfA0xgewwgekCAQEwPzA6MTgwNgYDVQQDDC9Mb29tU2VhbCBjb25mb3JtYW5jZSB2ZWN0b3IgdGltZXN0YW1wIGF1dGhvcml0eQIBBzALBglghkgBZQMEAgGgTTAaBgkqhkiG9w0BCQMxDQYLKoZIhvcNAQkQAQQwLwYJKoZIhvcNAQkEMSIEIFzI+IktKbtN7ux1YVIBqh0i5TiyDguq65yuvxktUuZfMAUGAytlcARAAlABngPnR2G+J4KaTtG8P0isql+d1bd61KjDUQx9RHez1A0Yh5Ztju4enR8uzxCWEVTkT3ZYBdKl5eY5pXkcDg==","ref":"https://tsa.example/tsr","seq":1,"type":"rfc3161"}],"bundle_id":"lsb_vectors","chain":{"head":{"link":"edc95cc965df1174b00847b99dbdeacf35ff09f7780d115c8676a6452d25134e","seq":1},"keyed":false,"params":{"install_id":"in_vectors"},"profile":"loomseal-chain-v1"},"claims":[{"at":"2026-07-27T15:00:00Z","chain":{"link":"edc95cc965df1174b00847b99dbdeacf35ff09f7780d115c8676a6452d25134e","prev":"","seq":1},"payload":{"actor":"release-token","method":"POST","path":"/api/runs"},"type":"switchtender.audit/1"}],"created_at":"2026-07-27T15:00:00Z","loomseal":"0.1","producer":{"install_id":"in_vectors","key_id":"sha256:65b60673d6ed884bf01c2c222d82ada0740f29ac3355d6a925c81f17f47a27b8","product":"vectors","product_version":"0.1.0","public_key":"ebVWLo/mVPlAeLES6KmLp5AfhTrmlb7X4OORC60ElmQ="},"signatures":[{"alg":"ed25519","key_id":"sha256:65b60673d6ed884bf01c2c222d82ada0740f29ac3355d6a925c81f17f47a27b8","sig":"rWIkoZaiUfQdA6pP6wakM+FRrQliZwk/mOuCZdhaKYUBAibFXfEB7XEYhwXqBo+lQpvj/krTGOtP0AzASAQfCg=="}],"subject":{"id":"demo-yard","type":"fleet"}}