{"anchors":[{"at":"2026-07-27T15:01:00Z","link":"edc95cc965df1174b00847b99dbdeacf35ff09f7780d115c8676a6452d25134e","proof":"MIIElQYJKoZIhvcNAQcCoIIEhjCCBIICAQMxDTALBglghkgBZQMEAgEwZgYLKoZIhvcNAQkQAQSgVwRVMFMCAQEGCSsGAQQBho0fATAvMAsGCWCGSAFlAwQCAQQgtRudZhxkVNjn6qws+BnSiNVAekvoGiTNF2JOcAlMUr4CASoYDzIwMjYwNzI3MTUwMTAwWqCCAkowggJGMIIB+KADAgECAgEHMAUGAytlcDA6MTgwNgYDVQQDDC9Mb29tU2VhbCBjb25mb3JtYW5jZSB2ZWN0b3IgdGltZXN0YW1wIGF1dGhvcml0eTAeFw0yNjAxMDEwMDAwMDBaFw0yNzAxMDEwMDAwMDBaMDoxODA2BgNVBAMML0xvb21TZWFsIGNvbmZvcm1hbmNlIHZlY3RvciB0aW1lc3RhbXAgYXV0aG9yaXR5MIIBIjANBgkqhkiG9w0BAQEFAAOCAQ8AMIIBCgKCAQEBHyX76pAWDYIhWkRVbv4dXZAI0PPlDOiYbH3asVo2+SQGRWOz2wS/nEQ1nHqfEB5L6AHR9lLyd9jNI55hryIxbKCDY7Gx1XCapdoGW0VtnEsaCOFDUOMQcpEPFjct69/kKrZ2r9H+NZw8HC9r7imPAHH1zCHCGak9q6E7BIwfqVjUePhCjF+ujLPnRBWIIIETl35UF0DSos0Wx1jPOSlU8Y3lLfH1Qyj+04INcYbGtOFKxwjNii0J0wdrfesDlKghVy5rV1Vpve57Gp8U0ws/LTReAmmqg50Cw+bDjSBuy5Yt8y//rTKPpCFUTmIa95zQm3rEVlAK7McbjpFeIF2UEQIDAQABoykwJzAWBgNVHSUBAf8EDDAKBggrBgEFBQcDCDANBgNVHQ4EBgQETFMBAjAFBgMrZXADQQDQxmy0/A3BkoL/+Ilhb9cFlOUFAq40eYYMnM/QMV1pLqXWxsvvIYWXkREnGwnvAFVzqDKNulJYE17b6iUKe0wGMYIBtjCCAbICAQEwPzA6MTgwNgYDVQQDDC9Mb29tU2VhbCBjb25mb3JtYW5jZSB2ZWN0b3IgdGltZXN0YW1wIGF1dGhvcml0eQIBBzALBglghkgBZQMEAgGgTTAaBgkqhkiG9w0BCQMxDQYLKoZIhvcNAQkQAQQwLwYJKoZIhvcNAQkEMSIEIFzI+IktKbtN7ux1YVIBqh0i5TiyDguq65yuvxktUuZfMAsGCSqGSIb3DQEBCgSCAQEA6HMORvUhOnysPRkKnZLO76jHmM9Y6+eG7hUDIz6gq1yNycjGLUwrjkGQqEjl/2OO8IrfLLKIwDrqQZ+gfUfdX+OR3mXXelXOALGITlRmBXfyXBwI1lA78X6j45yr/+cVWhzpoq9SbM5IQGNQJ6oOSRm+QZf6u0LANOamyDpPF3gZ4TFryOFfhp3Ma7Dk+2PIYgVsDlRGwYwz/MMzOTeKgORy0rRSCHB9PFa58ZrtFXkSbU2qF5XtP8RWFqB7/0KuNc32GIZfGDMbyxXUO1nq/QCz5ucV9wvdmLd0aTS1Fgu3UzWMifxzopXUOtUonWNqX4hlp0fxT1OcJ1f9Ctic1g==","ref":"https://tsa.example/tsr","seq":1,"type":"rfc3161"}],"bundle_id":"lsb_vectors","chain":{"head":{"link":"edc95cc965df1174b00847b99dbdeacf35ff09f7780d115c8676a6452d25134e","seq":1},"keyed":false,"params":{"install_id":"in_vectors"},"profile":"loomseal-chain-v1"},"claims":[{"at":"2026-07-27T15:00:00Z","chain":{"link":"edc95cc965df1174b00847b99dbdeacf35ff09f7780d115c8676a6452d25134e","prev":"","seq":1},"payload":{"actor":"release-token","method":"POST","path":"/api/runs"},"type":"switchtender.audit/1"}],"created_at":"2026-07-27T15:00:00Z","loomseal":"0.1","producer":{"install_id":"in_vectors","key_id":"sha256:65b60673d6ed884bf01c2c222d82ada0740f29ac3355d6a925c81f17f47a27b8","product":"vectors","product_version":"0.1.0","public_key":"ebVWLo/mVPlAeLES6KmLp5AfhTrmlb7X4OORC60ElmQ="},"signatures":[{"alg":"ed25519","key_id":"sha256:65b60673d6ed884bf01c2c222d82ada0740f29ac3355d6a925c81f17f47a27b8","sig":"WOhY4mPXSUAAzYv+KTUv40DO9tLnohSq+K+uurf2V9bZnesARdpXbdy0A3ZpmecR+nKBic1RaWhm6Uaqv8uRBQ=="}],"subject":{"id":"demo-yard","type":"fleet"}}