{"bundle_id":"lsb_vectors","chain":{"head":{"link":"0f413bb6bbdabe4959462af8c45117df12e7b2a7e22a8cdcf4236a0856766688","seq":4},"keyed":false,"profile":"switchtender-audit-v1"},"claims":[{"at":"2026-07-27T15:00:00Z","chain":{"link":"a31abd3eeb7517b5f7f897f413c5bed497c2214f204f9b5330890cdb20d203b2","prev":"","seq":1},"payload":{"actor":"deploy-bot","actor_type":"agent","method":"POST","on_behalf_of":"dev-lead","path":"/v1/runs"},"type":"switchtender.audit/1"},{"at":"2026-07-27T15:00:00Z","chain":{"link":"7fbf0b940293910619d3ec4de980329fbc449a0a7104c80fb02e5e3aafdf5d72","prev":"a31abd3eeb7517b5f7f897f413c5bed497c2214f204f9b5330890cdb20d203b2","seq":2},"payload":{"actor":"ops-admin","actor_type":"session","content_digest":"sha256s:a40316369f083fc2bc7ce9b749c8c6c4a0bb9f7cab21de3f475fb927bf03e868:d69a8ee53c4002d57fd752d822ed88ab9371602b80a197ff7e09f66f77889acd","decision_body":{"decision_id":"aud_decision","reason_commitment":"sha256:98f7470918dfb7a578106556816113d32b32726ff5fe62cc25b9e36e82d70493","run_id":"run_vectors","separation_of_duties":{"decider":"ops-admin","independent":true,"requester":"dev-lead","required":true,"result":"satisfied"},"spec_digest":"sha256:7d2f78f0323bdf0a4f5a7d0ae7703533aa53320a17de42e2c5cc7a8cb126d7ee","verdict":"approved"},"decision_nonce":"3678665005e30aca386ccf93dfb8273186358a7dda73386a408a9d5eab7eec36","method":"DECISION","on_behalf_of":"ops-admin","path":"/runs/run_vectors/decision/approved","reason_random":"82190835687ddf4cf54abc7cbb52b7fe468a8b9a7f989d1fed6cd2397698c977","reason_text":"approved after the change review & the on-call <sign-off>"},"type":"switchtender.audit/1"},{"at":"2026-07-27T15:00:00Z","chain":{"link":"d1f83d5ccdfc88e7ae2f21549ce1eb5a08742ce20ec3802b316e69eb2de4a57a","prev":"7fbf0b940293910619d3ec4de980329fbc449a0a7104c80fb02e5e3aafdf5d72","seq":3},"payload":{"actor":"ops-admin","actor_type":"session","content_digest":"sha256s:6c4937913c773a857800d8f37ba9a1b6d517a1ba592684e429cae7afd5ff1528:9f14e2ab1529963a4180493e01973282ea6005b010d0cb1969dfc3e374719032","correction_body":{"correction_id":"aud_correction","decision_id":"aud_decision","reason_commitment":"sha256:ef04fecf6b09c05bf901fb3dcc3b87599351c1c3d8b99ce1064f6e5554ccf09c","run_id":"run_vectors"},"correction_nonce":"6766019ab9fe96b3119cce6f2773a48a186cf29d3eb2409b5ee7456c8ccefc6c","method":"REASON","on_behalf_of":"ops-admin","path":"/runs/run_vectors/decisions/aud_decision/corrections/aud_correction","reason_random":"b2f9248505f24666336cf79d33b02b4c699eedb680f0b7ad1474b37d833306ff","reason_text":"approved after the change review, with the rollback plan attached"},"type":"switchtender.audit/1"},{"at":"2026-07-27T15:00:00Z","chain":{"link":"0f413bb6bbdabe4959462af8c45117df12e7b2a7e22a8cdcf4236a0856766688","prev":"d1f83d5ccdfc88e7ae2f21549ce1eb5a08742ce20ec3802b316e69eb2de4a57a","seq":4},"payload":{"actor":"system:dispatcher","actor_type":"system","content_digest":"sha256e:f76e0418fa42408f410503aa18d36524ad6187d1262e838f95cd306c15d5f4b1:261c76b350d0f88c384231d1a9334e3b48bde105280f353600641d4b9d91d637","method":"RUN","on_behalf_of":"deploy-bot","outcome_body":"{\"exit_code\":0,\"run_id\":\"run_vectors\",\"spec_digest\":\"sha256:7d2f78f0323bdf0a4f5a7d0ae7703533aa53320a17de42e2c5cc7a8cb126d7ee\",\"status\":\"succeeded\"}","outcome_nonce":"0d653e08577365aa90079257bfa5ef4a0c7618e0ecd91d09415113acbc891b2e","path":"/runs/run_vectors/outcome/succeeded","spec_body":"{\"command\":\"deploy\",\"tool\":\"bash\"}"},"type":"switchtender.audit/1"}],"created_at":"2026-07-27T15:00:00Z","loomseal":"0.1","producer":{"install_id":"in_vectors","key_id":"sha256:65b60673d6ed884bf01c2c222d82ada0740f29ac3355d6a925c81f17f47a27b8","product":"vectors","product_version":"0.1.0","public_key":"ebVWLo/mVPlAeLES6KmLp5AfhTrmlb7X4OORC60ElmQ="},"signatures":[{"alg":"ed25519","key_id":"sha256:65b60673d6ed884bf01c2c222d82ada0740f29ac3355d6a925c81f17f47a27b8","sig":"qSAIWaDI97+u2cYMefuU9RUa8sWhfscOnFmD4QWuh83JQqLbOKpd8j8nJ6cvoOyGCxh+wYiNt05S9asB1rSlDw=="}],"subject":{"id":"run_vectors","type":"run"}}